{"$schema":"https://json-schema.org/draft/2020-12/schema","description":"A timed plan of spoken cues for one talk. Produced by the generator, consumed by the runner, adjusted by the anchor matcher.","properties":{"generatedBy":{"description":"Provider that produced this plan (e.g. local, meta-model).","type":"string"},"paceWpm":{"description":"Speaking pace used for estimates, words per minute.","type":"number"},"sections":{"items":{"properties":{"anchors":{"description":"Distinctive phrases the speaker is likely to say near the START of this section. The matcher listens for these to locate the speaker.","items":{"type":"string"},"type":"array"},"cues":{"items":{"properties":{"atSecond":{"description":"Absolute time from talk start when this cue should be spoken.","type":"number"},"optional":{"description":"Optional cues are dropped first when the speaker is running late.","type":"boolean"},"text":{"description":"The exact words spoken in-ear. Keep to a few words.","type":"string"},"type":{"enum":["open","content","wrap","time","close"],"type":"string"}},"required":["atSecond","type","text"],"type":"object"},"type":"array"},"durationSecond":{"type":"number"},"heading":{"type":"string"},"id":{"type":"string"},"startSecond":{"type":"number"},"wordCount":{"type":"number"}},"required":["id","heading","startSecond","durationSecond","cues"],"type":"object"},"type":"array"},"targetSeconds":{"description":"Planned total talk length in seconds.","type":"number"},"title":{"type":"string"}},"required":["title","targetSeconds","paceWpm","sections"],"title":"CuePlan","type":"object"}